{
  "kind": "cineweave_codex_asset_recipe",
  "contractVersion": "2.0.0",
  "worldId": "world-cloud-dynasty",
  "recipeId": "recipe.shen-expression-sheet-3x3",
  "title": "沈砚秋人物定妆九宫格",
  "version": 1,
  "status": "draft",
  "ownerRoute": "character",
  "category": "character",
  "outputType": "expression_sheet",
  "purpose": "在统一身份、造型、背景、光照和镜头条件下比较九种表情状态。",
  "recipeMode": "instance",
  "parameters": [
    {
      "name": "background",
      "type": "enum",
      "description": "统一背景",
      "required": true,
      "default": "neutral_gray",
      "values": [
        "white",
        "neutral_gray",
        "charcoal"
      ]
    },
    {
      "name": "shotScale",
      "type": "enum",
      "description": "统一景别",
      "required": true,
      "default": "medium_closeup",
      "values": [
        "closeup",
        "medium_closeup"
      ]
    }
  ],
  "inputSlots": [
    {
      "slotName": "characterSpec",
      "role": "identity",
      "acceptedKinds": [
        "cineweave_codex_character_spec"
      ],
      "required": true,
      "cardinality": "one",
      "description": "锁定人物身份和身体节奏。"
    },
    {
      "slotName": "appearanceState",
      "role": "appearance",
      "acceptedKinds": [
        "cineweave_codex_character_appearance_state"
      ],
      "required": true,
      "cardinality": "one",
      "description": "锁定妆容、发型、服装和饰品。"
    },
    {
      "slotName": "controls",
      "role": "control",
      "acceptedKinds": [
        "cineweave_codex_control_channel_set"
      ],
      "required": true,
      "cardinality": "one",
      "description": "声明 hard/soft/advisory 控制优先级。"
    },
    {
      "slotName": "evidence",
      "role": "evidence",
      "acceptedKinds": [
        "cineweave_codex_evidence_bundle"
      ],
      "required": true,
      "cardinality": "one",
      "description": "提供身份、身体和造型证据。"
    }
  ],
  "bindings": [
    {
      "slotName": "characterSpec",
      "ref": {
        "kind": "cineweave_codex_character_spec",
        "id": "char.shen-yanqiu",
        "version": 1,
        "contentHash": "sha256:bbbbbbbbbbbbbbbbbbbbbbbbbbbbbbbbbbbbbbbbbbbbbbbbbbbbbbbbbbbbbbbb"
      }
    },
    {
      "slotName": "appearanceState",
      "ref": {
        "kind": "cineweave_codex_character_appearance_state",
        "id": "appearance.shen-duty",
        "version": 1,
        "contentHash": "sha256:cccccccccccccccccccccccccccccccccccccccccccccccccccccccccccccccc"
      }
    },
    {
      "slotName": "controls",
      "ref": {
        "kind": "cineweave_codex_control_channel_set",
        "id": "controls.shen-expression-sheet",
        "version": 1,
        "contentHash": "sha256:8888888888888888888888888888888888888888888888888888888888888888"
      }
    },
    {
      "slotName": "evidence",
      "ref": {
        "kind": "cineweave_codex_evidence_bundle",
        "id": "evidence.shen-production",
        "version": 1,
        "contentHash": "sha256:9999999999999999999999999999999999999999999999999999999999999999"
      }
    }
  ],
  "layout": {
    "type": "contact_sheet",
    "rows": 3,
    "cols": 3,
    "canvas": {
      "aspectRatio": "1:1",
      "sizeClass": "square",
      "pixelDimensions": "3072x3072",
      "background": "中性灰"
    },
    "tileAspectRatio": "1:1",
    "margin": 0.04,
    "gutter": 0.025,
    "labelPolicy": "outside_tile",
    "cameraConsistency": true,
    "backgroundPolicy": "locked",
    "lightingPolicy": "locked"
  },
  "sharedInvariants": [
    "CharacterSpec v1 身份锚点",
    "AppearanceState v1 妆容、发型、服装与配饰",
    "保持相同机位、焦点人物与裁切",
    "保持相同中性灰背景与中性柔光"
  ],
  "tasks": [
    {
      "taskId": "task.expression.neutral",
      "label": "中性",
      "outputSlot": "tile-01",
      "delta": [
        {
          "fieldPath": "characterBinding.performanceState.emotion",
          "operation": "set",
          "value": "中性",
          "rationale": "九宫格每格只改变表情主状态。"
        }
      ],
      "parameterOverrides": {
        "emotionIntensity": 0,
        "concealment": 0
      },
      "controlChannelIds": [
        "control.identity.face",
        "control.body.rhythm",
        "control.appearance.lock",
        "control.expression.delta",
        "control.camera.lock",
        "control.style.advisory"
      ],
      "evaluationCriteria": [
        "同一人物身份",
        "表情与强度可读",
        "妆容发型服装不漂移",
        "镜头背景光照一致"
      ],
      "promptIntent": "沈砚秋 中性，情绪强度 0.00，隐藏程度 0.00。"
    },
    {
      "taskId": "task.expression.soft-smile",
      "label": "轻微喜悦",
      "outputSlot": "tile-02",
      "delta": [
        {
          "fieldPath": "characterBinding.performanceState.emotion",
          "operation": "set",
          "value": "轻微喜悦",
          "rationale": "九宫格每格只改变表情主状态。"
        }
      ],
      "parameterOverrides": {
        "emotionIntensity": 0.22,
        "concealment": 0.25
      },
      "controlChannelIds": [
        "control.identity.face",
        "control.body.rhythm",
        "control.appearance.lock",
        "control.expression.delta",
        "control.camera.lock",
        "control.style.advisory"
      ],
      "evaluationCriteria": [
        "同一人物身份",
        "表情与强度可读",
        "妆容发型服装不漂移",
        "镜头背景光照一致"
      ],
      "promptIntent": "沈砚秋 轻微喜悦，情绪强度 0.22，隐藏程度 0.25。"
    },
    {
      "taskId": "task.expression.calm",
      "label": "平静",
      "outputSlot": "tile-03",
      "delta": [
        {
          "fieldPath": "characterBinding.performanceState.emotion",
          "operation": "set",
          "value": "平静",
          "rationale": "九宫格每格只改变表情主状态。"
        }
      ],
      "parameterOverrides": {
        "emotionIntensity": 0.15,
        "concealment": 0.75
      },
      "controlChannelIds": [
        "control.identity.face",
        "control.body.rhythm",
        "control.appearance.lock",
        "control.expression.delta",
        "control.camera.lock",
        "control.style.advisory"
      ],
      "evaluationCriteria": [
        "同一人物身份",
        "表情与强度可读",
        "妆容发型服装不漂移",
        "镜头背景光照一致"
      ],
      "promptIntent": "沈砚秋 平静，情绪强度 0.15，隐藏程度 0.75。"
    },
    {
      "taskId": "task.expression.sadness",
      "label": "压抑悲伤",
      "outputSlot": "tile-04",
      "delta": [
        {
          "fieldPath": "characterBinding.performanceState.emotion",
          "operation": "set",
          "value": "压抑悲伤",
          "rationale": "九宫格每格只改变表情主状态。"
        }
      ],
      "parameterOverrides": {
        "emotionIntensity": 0.35,
        "concealment": 0.8
      },
      "controlChannelIds": [
        "control.identity.face",
        "control.body.rhythm",
        "control.appearance.lock",
        "control.expression.delta",
        "control.camera.lock",
        "control.style.advisory"
      ],
      "evaluationCriteria": [
        "同一人物身份",
        "表情与强度可读",
        "妆容发型服装不漂移",
        "镜头背景光照一致"
      ],
      "promptIntent": "沈砚秋 压抑悲伤，情绪强度 0.35，隐藏程度 0.80。"
    },
    {
      "taskId": "task.expression.anger",
      "label": "克制愤怒",
      "outputSlot": "tile-05",
      "delta": [
        {
          "fieldPath": "characterBinding.performanceState.emotion",
          "operation": "set",
          "value": "克制愤怒",
          "rationale": "九宫格每格只改变表情主状态。"
        }
      ],
      "parameterOverrides": {
        "emotionIntensity": 0.42,
        "concealment": 0.85
      },
      "controlChannelIds": [
        "control.identity.face",
        "control.body.rhythm",
        "control.appearance.lock",
        "control.expression.delta",
        "control.camera.lock",
        "control.style.advisory"
      ],
      "evaluationCriteria": [
        "同一人物身份",
        "表情与强度可读",
        "妆容发型服装不漂移",
        "镜头背景光照一致"
      ],
      "promptIntent": "沈砚秋 克制愤怒，情绪强度 0.42，隐藏程度 0.85。"
    },
    {
      "taskId": "task.expression.surprise",
      "label": "轻度惊讶",
      "outputSlot": "tile-06",
      "delta": [
        {
          "fieldPath": "characterBinding.performanceState.emotion",
          "operation": "set",
          "value": "轻度惊讶",
          "rationale": "九宫格每格只改变表情主状态。"
        }
      ],
      "parameterOverrides": {
        "emotionIntensity": 0.4,
        "concealment": 0.35
      },
      "controlChannelIds": [
        "control.identity.face",
        "control.body.rhythm",
        "control.appearance.lock",
        "control.expression.delta",
        "control.camera.lock",
        "control.style.advisory"
      ],
      "evaluationCriteria": [
        "同一人物身份",
        "表情与强度可读",
        "妆容发型服装不漂移",
        "镜头背景光照一致"
      ],
      "promptIntent": "沈砚秋 轻度惊讶，情绪强度 0.40，隐藏程度 0.35。"
    },
    {
      "taskId": "task.expression.confusion",
      "label": "疑惑",
      "outputSlot": "tile-07",
      "delta": [
        {
          "fieldPath": "characterBinding.performanceState.emotion",
          "operation": "set",
          "value": "疑惑",
          "rationale": "九宫格每格只改变表情主状态。"
        }
      ],
      "parameterOverrides": {
        "emotionIntensity": 0.3,
        "concealment": 0.55
      },
      "controlChannelIds": [
        "control.identity.face",
        "control.body.rhythm",
        "control.appearance.lock",
        "control.expression.delta",
        "control.camera.lock",
        "control.style.advisory"
      ],
      "evaluationCriteria": [
        "同一人物身份",
        "表情与强度可读",
        "妆容发型服装不漂移",
        "镜头背景光照一致"
      ],
      "promptIntent": "沈砚秋 疑惑，情绪强度 0.30，隐藏程度 0.55。"
    },
    {
      "taskId": "task.expression.fear",
      "label": "隐藏恐惧",
      "outputSlot": "tile-08",
      "delta": [
        {
          "fieldPath": "characterBinding.performanceState.emotion",
          "operation": "set",
          "value": "隐藏恐惧",
          "rationale": "九宫格每格只改变表情主状态。"
        }
      ],
      "parameterOverrides": {
        "emotionIntensity": 0.38,
        "concealment": 0.82
      },
      "controlChannelIds": [
        "control.identity.face",
        "control.body.rhythm",
        "control.appearance.lock",
        "control.expression.delta",
        "control.camera.lock",